{
  "truthId": "task-settings-221.pet-turtle-behavior",
  "status": "behavior-evidence",
  "forms": [
    {
      "form": 1,
      "className": "PetTurtle1",
      "baseClass": "BasePet",
      "rangeExpression": "40",
      "attacksAt24Fps": {
        "hit1": {
          "hitMaxCount": 99,
          "attackBackSpeed": [
            6,
            -5
          ],
          "attackInterval": 999,
          "power": 12,
          "attackKind": "physics"
        },
        "hit2": {
          "hitMaxCount": 99,
          "attackBackSpeed": [
            10,
            0
          ],
          "attackInterval": 7,
          "power": 12,
          "attackKind": "magic"
        }
      },
      "rowFrameCounts": [
        6,
        1,
        5,
        3,
        3
      ],
      "rowHolds": [
        [
          2,
          2,
          2,
          3,
          2,
          4
        ],
        [
          8
        ],
        [
          2,
          2,
          2,
          2,
          2
        ],
        [
          2,
          2,
          10
        ],
        [
          2,
          2,
          10
        ]
      ],
      "skills": [
        "sld"
      ],
      "source": {
        "path": "local-resources/regima/legacy-extraction/resources_by_swf/[172845].swf/scripts/export/pet/PetTurtle1.as",
        "method": "PetTurtle1",
        "line": 12,
        "sha256": "639919b81c44213e089dd7710085c9bcb130c786fa4dad8f5f7086c983930407",
        "sliceSha256": "cc7ce81ef8e6b51b708f09548c334b13d1a4436c8f78e4793bf3336fb4b66c40"
      }
    },
    {
      "form": 2,
      "className": "PetTurtle2",
      "baseClass": "BasePet",
      "rangeExpression": "2 * 60",
      "attacksAt24Fps": {
        "hit1": {
          "hitMaxCount": 99,
          "attackBackSpeed": [
            6,
            -5
          ],
          "attackInterval": 999,
          "power": 12,
          "attackKind": "physics"
        },
        "hit2": {
          "hitMaxCount": 99,
          "attackBackSpeed": [
            10,
            0
          ],
          "attackInterval": 999,
          "power": 12,
          "attackKind": "magic"
        }
      },
      "rowFrameCounts": [
        6,
        4,
        1,
        5,
        4,
        3
      ],
      "rowHolds": [
        [
          2,
          2,
          2,
          3,
          2,
          4
        ],
        [
          4,
          4,
          4,
          4
        ],
        [
          8
        ],
        [
          2,
          2,
          2,
          2,
          2
        ],
        [
          2,
          2,
          2,
          10
        ],
        [
          2,
          2,
          10
        ]
      ],
      "skills": [
        "sld",
        "txlj"
      ],
      "source": {
        "path": "local-resources/regima/legacy-extraction/resources_by_swf/[172845].swf/scripts/export/pet/PetTurtle2.as",
        "method": "PetTurtle2",
        "line": 12,
        "sha256": "99c41ef0f2884b4e14874d58711dc02972e8508b19b2b8362bbc30ff7c6268ca",
        "sliceSha256": "b27686e7135468435272c0201be34ec786841d353f7c5a4145e846a55d8ed599"
      }
    },
    {
      "form": 3,
      "className": "PetTurtle3",
      "baseClass": "BasePet",
      "rangeExpression": "150",
      "attacksAt24Fps": {
        "hit1": {
          "hitMaxCount": 99,
          "attackBackSpeed": [
            6,
            -5
          ],
          "attackInterval": 999,
          "power": 12,
          "attackKind": "physics"
        },
        "hit2": {
          "hitMaxCount": 99,
          "attackBackSpeed": [
            10,
            0
          ],
          "attackInterval": 999,
          "power": 12,
          "attackKind": "magic"
        },
        "hit3": {
          "hitMaxCount": 99,
          "attackBackSpeed": [
            5,
            0
          ],
          "attackInterval": 999,
          "power": 12,
          "attackKind": "magic"
        }
      },
      "rowFrameCounts": [
        6,
        4,
        1,
        5,
        4,
        3,
        3
      ],
      "rowHolds": [
        [
          2,
          2,
          2,
          3,
          2,
          4
        ],
        [
          4,
          4,
          4,
          4
        ],
        [
          8
        ],
        [
          2,
          2,
          2,
          2,
          2
        ],
        [
          2,
          2,
          2,
          10
        ],
        [
          2,
          2,
          10
        ],
        [
          2,
          2,
          10
        ]
      ],
      "skills": [
        "sld",
        "txlj",
        "sybh"
      ],
      "source": {
        "path": "local-resources/regima/legacy-extraction/resources_by_swf/[172845].swf/scripts/export/pet/PetTurtle3.as",
        "method": "PetTurtle3",
        "line": 12,
        "sha256": "036fccccc05e8c05f29478957c0218c6098bbd0fef846fbcca483912b7b3e281",
        "sliceSha256": "32c36ecf7f16e02936086d650080394beeae36ed43437a478c121ff3a7f9b100"
      }
    },
    {
      "form": 4,
      "className": "PetTurtle4",
      "baseClass": "BasePet",
      "rangeExpression": "150",
      "attacksAt24Fps": {
        "hit1": {
          "hitMaxCount": 99,
          "attackBackSpeed": [
            6,
            -5
          ],
          "attackInterval": 999,
          "power": 12,
          "attackKind": "physics"
        },
        "hit2": {
          "hitMaxCount": 99,
          "attackBackSpeed": [
            6,
            0
          ],
          "attackInterval": 999,
          "power": 12,
          "attackKind": "physics"
        },
        "hit3": {
          "hitMaxCount": 99,
          "attackBackSpeed": [
            2,
            0
          ],
          "attackInterval": 6,
          "power": 12,
          "attackKind": "magic"
        }
      },
      "rowFrameCounts": [
        6,
        4,
        1,
        5,
        4,
        3,
        3
      ],
      "rowHolds": [
        [
          2,
          2,
          2,
          3,
          2,
          4
        ],
        [
          4,
          4,
          4,
          4
        ],
        [
          8
        ],
        [
          2,
          2,
          2,
          2,
          2
        ],
        [
          2,
          2,
          2,
          10
        ],
        [
          2,
          2,
          10
        ],
        [
          2,
          2,
          10
        ]
      ],
      "skills": [
        "sld",
        "txlj",
        "sybh",
        "xwaoyi"
      ],
      "source": {
        "path": "local-resources/regima/legacy-extraction/resources_by_swf/[172845].swf/scripts/export/pet/PetTurtle4.as",
        "method": "PetTurtle4",
        "line": 16,
        "sha256": "0e6f79b5b29af82def5afd978239e1bc2b1219bff7e4a29ce042b8e2baa84e33",
        "sliceSha256": "6c2f00fd1fe32ffaefd19f29bf860f9a32b0f1dd2b6b8f7df56a8fb3c99340e8"
      }
    }
  ],
  "contracts": [
    {
      "id": "entry.forms",
      "source": {
        "path": "local-resources/regima/legacy-extraction/resources_by_swf/[172845].swf/scripts/base/BaseHero.as",
        "method": "addPetByPi",
        "line": 448,
        "sha256": "821eb938395609f6cc496c1eb07d054d3f0a5c67590ca2de50fb82e938f9f3f8",
        "sliceSha256": "63e87788aa48540b269aee62313a2e8008ba52840bbf919844d4bae2616874e7"
      },
      "fixtureSelector": "init-",
      "modernConsumer": "PetCombatRuntime",
      "statement": "四类直接继承BasePet；按petName实例化对应类",
      "evidenceLevel": "确认事实",
      "geometry": "deferred-to-TASK-SETTINGS-222"
    },
    {
      "id": "ai.priority",
      "source": {
        "path": "local-resources/regima/legacy-extraction/resources_by_swf/[172845].swf/scripts/base/BasePet.as",
        "method": "myIntelligence",
        "line": 305,
        "sha256": "29445a84725a475a69d4a779eec57d488a2288a306ae7555e8ce8f5abd622c42",
        "sliceSha256": "fe16e6c47448fdf4ca7c2573d7caae7d4a4b0ec3ac3ed67c834e51387b23b6ea"
      },
      "fixtureSelector": "priority-",
      "modernConsumer": "PetCombatRuntime",
      "statement": "sld→txlj→sybh→xwaoyi→秒拍普攻；AI后CD减一",
      "evidenceLevel": "确认事实",
      "geometry": "deferred-to-TASK-SETTINGS-222"
    },
    {
      "id": "ai.range",
      "source": {
        "path": "local-resources/regima/legacy-extraction/resources_by_swf/[172845].swf/scripts/base/BasePet.as",
        "method": "myIntelligence",
        "line": 305,
        "sha256": "29445a84725a475a69d4a779eec57d488a2288a306ae7555e8ce8f5abd622c42",
        "sliceSha256": "fe16e6c47448fdf4ca7c2573d7caae7d4a4b0ec3ac3ed67c834e51387b23b6ea"
      },
      "fixtureSelector": "outside-|inside-",
      "modernConsumer": "PetCombatTargeting",
      "statement": "40/120/150/150内才按0.7首随机普攻，失败再独立0.3随机",
      "evidenceLevel": "确认事实",
      "geometry": "deferred-to-TASK-SETTINGS-222"
    },
    {
      "id": "ai.owner",
      "source": {
        "path": "local-resources/regima/legacy-extraction/resources_by_swf/[172845].swf/scripts/base/BasePet.as",
        "method": "myIntelligence",
        "line": 305,
        "sha256": "29445a84725a475a69d4a779eec57d488a2288a306ae7555e8ce8f5abd622c42",
        "sliceSha256": "fe16e6c47448fdf4ca7c2573d7caae7d4a4b0ec3ac3ed67c834e51387b23b6ea"
      },
      "fixtureSelector": "remote-",
      "modernConsumer": "HeroPartyRuntimeBridge",
      "statement": "single或sourceRole.sid本地才自动选择；两玩家各自owner",
      "evidenceLevel": "确认事实",
      "geometry": "deferred-to-TASK-SETTINGS-222"
    },
    {
      "id": "ai.target",
      "source": {
        "path": "local-resources/regima/legacy-extraction/resources_by_swf/[172845].swf/scripts/base/BasePet.as",
        "method": "searchTarget",
        "line": 1075,
        "sha256": "29445a84725a475a69d4a779eec57d488a2288a306ae7555e8ce8f5abd622c42",
        "sliceSha256": "61db7ab2bea3d9c5924608da5013049bea1e28a53444ceac152c509a948de9b8"
      },
      "fixtureSelector": "outside-",
      "modernConsumer": "PetCombatTargeting",